Заголовок(меню),Информация
Старт,"Здравствуйте! Мы — благотворительная организация “Вместе ради жизни”. С 2011 года мы словом и делом помогаем тем, кто столкнулся с онкологическим диагнозом: поддерживаем, направляем, окутываем теплом и заботой. Чем мы можем помочь именно вам?"
"Поставили диагноз онкология. Что делать?","Вам (или Вашему близкому) поставили диагноз, и Вы не знаете, что делать дальше? Онкологический диагноз полностью меняет жизнь как самого пациента, так и его близких. На смену привычному укладу приходят неопределённость и страх неизвестности. Мы работаем для того, чтобы показать, что рак — это не приговор. Рак — это заболевание, почти всегда поддающееся лечению. И мы готовы пройти этот путь вместе."
"Расписание занятий в Центре","Хотите узнать, как попасть на занятия в Центр? Актуальное расписание доступно по ссылке: https://vk.com/vmesteradizhizni?w=wall-153840035_3357"
"Записаться на консультацию","Получить консультации онкопсихолога или равного консультанта можно по предварительной записи по телефону  +7(343)219-02-75."
"Юридическая помощь","Чтобы получить ответ на вопрос в юридической, правовой или социальной сфере, например, если Вам необходимо оформить группу инвалидности и Вы нуждаетесь в сопровождении в медицинские и социальные учреждения (в том числе на такси), или Вам нужно записаться на приём к врачу через онлайн-сервис, или Вам необходима помощь в получении необходимых лекарств, а так же помощь в оформлении льгот, компенсаций, получении государственной социальной помощи, то мы Вам предлагаем участвовать в нашем проекте “Служба заботы”, где мы Вам сможем оказать эту помощь. Для участия в этом проекте необходимо пройти предварительную консультацию специалиста по социальным вопросам очно или по телефону +7 (343) 219-02-75."
"Чем мы занимаемся (наши проекты)","Узнать, какие проекты сейчас действуют и как к ним можно присоединиться - https://vmesteradizhizni.ru/projects/"
"Хочу помочь Центру","Хотите помочь организации или поблагодарить за работу? Если Вы хотите стать нашим волонтёром, то заполните, пожалуйста, форму для отправки данных (анкета волонтёра) - https://vmesteradizhizni.ru/volunteers/. Если Вы хотите помочь нам в нашей работе или хотите поблагодарить за то, что мы делаем, подпишитесь на регулярное пожертвование или оформите единовременный платёж и расскажите об этом друзьям: чем больше людей поддержит нас, тем большему количеству онкопациентов мы сможем помочь. Подробнее - https://vmesteradizhizni.ru/campaign/na-ustavnuyu-deyatelnost/"
"Другое (задать вопрос)","Напишите, пожалуйста, что бы Вы хотели узнать максимально подробно. Наши специалисты ответят Вам в скором времени."